{"formatVersion":1,"profile":"unicode16-search-characters-v1","unicodeVersion":"16.0.0","ordinaryCategories":["Lu","Ll","Lt","Lm","Lo","Mn","Mc","Me","Nd"],"defaultCategory":"Cn","unicodeDataSha256":"ff58e5823bd095166564a006e47d111130813dcf8bf234ef79fa51a870edb48f","licenseSha256":"e7a93b009565cfce55919a381437ac4db883e9da2126fa28b91d12732bc53d96","ranges":[[0,31,"Cc"],[32,32,"Zs"],[33,35,"Po"],[36,36,"Sc"],[37,39,"Po"],[40,40,"Ps"],[41,41,"Pe"],[42,42,"Po"],[43,43,"Sm"],[44,44,"Po"],[45,45,"Pd"],[46,47,"Po"],[48,57,"Nd"],[58,59,"Po"],[60,62,"Sm"],[63,64,"Po"],[65,90,"Lu"],[91,91,"Ps"],[92,92,"Po"],[93,93,"Pe"],[94,94,"Sk"],[95,95,"Pc"],[96,96,"Sk"],[97,122,"Ll"],[123,123,"Ps"],[124,124,"Sm"],[125,125,"Pe"],[126,126,"Sm"],[127,159,"Cc"],[160,160,"Zs"],[161,161,"Po"],[162,165,"Sc"],[166,166,"So"],[167,167,"Po"],[168,168,"Sk"],[169,169,"So"],[170,170,"Lo"],[171,171,"Pi"],[172,172,"Sm"],[173,173,"Cf"],[174,174,"So"],[175,175,"Sk"],[176,176,"So"],[177,177,"Sm"],[178,179,"No"],[180,180,"Sk"],[181,181,"Ll"],[182,183,"Po"],[184,184,"Sk"],[185,185,"No"],[186,186,"Lo"],[187,187,"Pf"],[188,190,"No"],[191,191,"Po"],[192,214,"Lu"],[215,215,"Sm"],[216,222,"Lu"],[223,246,"Ll"],[247,247,"Sm"],[248,255,"Ll"],[256,256,"Lu"],[257,257,"Ll"],[258,258,"Lu"],[259,259,"Ll"],[260,260,"Lu"],[261,261,"Ll"],[262,262,"Lu"],[263,263,"Ll"],[264,264,"Lu"],[265,265,"Ll"],[266,266,"Lu"],[267,267,"Ll"],[268,268,"Lu"],[269,269,"Ll"],[270,270,"Lu"],[271,271,"Ll"],[272,272,"Lu"],[273,273,"Ll"],[274,274,"Lu"],[275,275,"Ll"],[276,276,"Lu"],[277,277,"Ll"],[278,278,"Lu"],[279,279,"Ll"],[280,280,"Lu"],[281,281,"Ll"],[282,282,"Lu"],[283,283,"Ll"],[284,284,"Lu"],[285,285,"Ll"],[286,286,"Lu"],[287,287,"Ll"],[288,288,"Lu"],[289,289,"Ll"],[290,290,"Lu"],[291,291,"Ll"],[292,292,"Lu"],[293,293,"Ll"],[294,294,"Lu"],[295,295,"Ll"],[296,296,"Lu"],[297,297,"Ll"],[298,298,"Lu"],[299,299,"Ll"],[300,300,"Lu"],[301,301,"Ll"],[302,302,"Lu"],[303,303,"Ll"],[304,304,"Lu"],[305,305,"Ll"],[306,306,"Lu"],[307,307,"Ll"],[308,308,"Lu"],[309,309,"Ll"],[310,310,"Lu"],[311,312,"Ll"],[313,313,"Lu"],[314,314,"Ll"],[315,315,"Lu"],[316,316,"Ll"],[317,317,"Lu"],[318,318,"Ll"],[319,319,"Lu"],[320,320,"Ll"],[321,321,"Lu"],[322,322,"Ll"],[323,323,"Lu"],[324,324,"Ll"],[325,325,"Lu"],[326,326,"Ll"],[327,327,"Lu"],[328,329,"Ll"],[330,330,"Lu"],[331,331,"Ll"],[332,332,"Lu"],[333,333,"Ll"],[334,334,"Lu"],[335,335,"Ll"],[336,336,"Lu"],[337,337,"Ll"],[338,338,"Lu"],[339,339,"Ll"],[340,340,"Lu"],[341,341,"Ll"],[342,342,"Lu"],[343,343,"Ll"],[344,344,"Lu"],[345,345,"Ll"],[346,346,"Lu"],[347,347,"Ll"],[348,348,"Lu"],[349,349,"Ll"],[350,350,"Lu"],[351,351,"Ll"],[352,352,"Lu"],[353,353,"Ll"],[354,354,"Lu"],[355,355,"Ll"],[356,356,"Lu"],[357,357,"Ll"],[358,358,"Lu"],[359,359,"Ll"],[360,360,"Lu"],[361,361,"Ll"],[362,362,"Lu"],[363,363,"Ll"],[364,364,"Lu"],[365,365,"Ll"],[366,366,"Lu"],[367,367,"Ll"],[368,368,"Lu"],[369,369,"Ll"],[370,370,"Lu"],[371,371,"Ll"],[372,372,"Lu"],[373,373,"Ll"],[374,374,"Lu"],[375,375,"Ll"],[376,377,"Lu"],[378,378,"Ll"],[379,379,"Lu"],[380,380,"Ll"],[381,381,"Lu"],[382,384,"Ll"],[385,386,"Lu"],[387,387,"Ll"],[388,388,"Lu"],[389,389,"Ll"],[390,391,"Lu"],[392,392,"Ll"],[393,395,"Lu"],[396,397,"Ll"],[398,401,"Lu"],[402,402,"Ll"],[403,404,"Lu"],[405,405,"Ll"],[406,408,"Lu"],[409,411,"Ll"],[412,413,"Lu"],[414,414,"Ll"],[415,416,"Lu"],[417,417,"Ll"],[418,418,"Lu"],[419,419,"Ll"],[420,420,"Lu"],[421,421,"Ll"],[422,423,"Lu"],[424,424,"Ll"],[425,425,"Lu"],[426,427,"Ll"],[428,428,"Lu"],[429,429,"Ll"],[430,431,"Lu"],[432,432,"Ll"],[433,435,"Lu"],[436,436,"Ll"],[437,437,"Lu"],[438,438,"Ll"],[439,440,"Lu"],[441,442,"Ll"],[443,443,"Lo"],[444,444,"Lu"],[445,447,"Ll"],[448,451,"Lo"],[452,452,"Lu"],[453,453,"Lt"],[454,454,"Ll"],[455,455,"Lu"],[456,456,"Lt"],[457,457,"Ll"],[458,458,"Lu"],[459,459,"Lt"],[460,460,"Ll"],[461,461,"Lu"],[462,462,"Ll"],[463,463,"Lu"],[464,464,"Ll"],[465,465,"Lu"],[466,466,"Ll"],[467,467,"Lu"],[468,468,"Ll"],[469,469,"Lu"],[470,470,"Ll"],[471,471,"Lu"],[472,472,"Ll"],[473,473,"Lu"],[474,474,"Ll"],[475,475,"Lu"],[476,477,"Ll"],[478,478,"Lu"],[479,479,"Ll"],[480,480,"Lu"],[481,481,"Ll"],[482,482,"Lu"],[483,483,"Ll"],[484,484,"Lu"],[485,485,"Ll"],[486,486,"Lu"],[487,487,"Ll"],[488,488,"Lu"],[489,489,"Ll"],[490,490,"Lu"],[491,491,"Ll"],[492,492,"Lu"],[493,493,"Ll"],[494,494,"Lu"],[495,496,"Ll"],[497,497,"Lu"],[498,498,"Lt"],[499,499,"Ll"],[500,500,"Lu"],[501,501,"Ll"],[502,504,"Lu"],[505,505,"Ll"],[506,506,"Lu"],[507,507,"Ll"],[508,508,"Lu"],[509,509,"Ll"],[510,510,"Lu"],[511,511,"Ll"],[512,512,"Lu"],[513,513,"Ll"],[514,514,"Lu"],[515,515,"Ll"],[516,516,"Lu"],[517,517,"Ll"],[518,518,"Lu"],[519,519,"Ll"],[520,520,"Lu"],[521,521,"Ll"],[522,522,"Lu"],[523,523,"Ll"],[524,524,"Lu"],[525,525,"Ll"],[526,526,"Lu"],[527,527,"Ll"],[528,528,"Lu"],[529,529,"Ll"],[530,530,"Lu"],[531,531,"Ll"],[532,532,"Lu"],[533,533,"Ll"],[534,534,"Lu"],[535,535,"Ll"],[536,536,"Lu"],[537,537,"Ll"],[538,538,"Lu"],[539,539,"Ll"],[540,540,"Lu"],[541,541,"Ll"],[542,542,"Lu"],[543,543,"Ll"],[544,544,"Lu"],[545,545,"Ll"],[546,546,"Lu"],[547,547,"Ll"],[548,548,"Lu"],[549,549,"Ll"],[550,550,"Lu"],[551,551,"Ll"],[552,552,"Lu"],[553,553,"Ll"],[554,554,"Lu"],[555,555,"Ll"],[556,556,"Lu"],[557,557,"Ll"],[558,558,"Lu"],[559,559,"Ll"],[560,560,"Lu"],[561,561,"Ll"],[562,562,"Lu"],[563,569,"Ll"],[570,571,"Lu"],[572,572,"Ll"],[573,574,"Lu"],[575,576,"Ll"],[577,577,"Lu"],[578,578,"Ll"],[579,582,"Lu"],[583,583,"Ll"],[584,584,"Lu"],[585,585,"Ll"],[586,586,"Lu"],[587,587,"Ll"],[588,588,"Lu"],[589,589,"Ll"],[590,590,"Lu"],[591,659,"Ll"],[660,660,"Lo"],[661,687,"Ll"],[688,705,"Lm"],[706,709,"Sk"],[710,721,"Lm"],[722,735,"Sk"],[736,740,"Lm"],[741,747,"Sk"],[748,748,"Lm"],[749,749,"Sk"],[750,750,"Lm"],[751,767,"Sk"],[768,879,"Mn"],[880,880,"Lu"],[881,881,"Ll"],[882,882,"Lu"],[883,883,"Ll"],[884,884,"Lm"],[885,885,"Sk"],[886,886,"Lu"],[887,887,"Ll"],[890,890,"Lm"],[891,893,"Ll"],[894,894,"Po"],[895,895,"Lu"],[900,901,"Sk"],[902,902,"Lu"],[903,903,"Po"],[904,906,"Lu"],[908,908,"Lu"],[910,911,"Lu"],[912,912,"Ll"],[913,929,"Lu"],[931,939,"Lu"],[940,974,"Ll"],[975,975,"Lu"],[976,977,"Ll"],[978,980,"Lu"],[981,983,"Ll"],[984,984,"Lu"],[985,985,"Ll"],[986,986,"Lu"],[987,987,"Ll"],[988,988,"Lu"],[989,989,"Ll"],[990,990,"Lu"],[991,991,"Ll"],[992,992,"Lu"],[993,993,"Ll"],[994,994,"Lu"],[995,995,"Ll"],[996,996,"Lu"],[997,997,"Ll"],[998,998,"Lu"],[999,999,"Ll"],[1000,1000,"Lu"],[1001,1001,"Ll"],[1002,1002,"Lu"],[1003,1003,"Ll"],[1004,1004,"Lu"],[1005,1005,"Ll"],[1006,1006,"Lu"],[1007,1011,"Ll"],[1012,1012,"Lu"],[1013,1013,"Ll"],[1014,1014,"Sm"],[1015,1015,"Lu"],[1016,1016,"Ll"],[1017,1018,"Lu"],[1019,1020,"Ll"],[1021,1071,"Lu"],[1072,1119,"Ll"],[1120,1120,"Lu"],[1121,1121,"Ll"],[1122,1122,"Lu"],[1123,1123,"Ll"],[1124,1124,"Lu"],[1125,1125,"Ll"],[1126,1126,"Lu"],[1127,1127,"Ll"],[1128,1128,"Lu"],[1129,1129,"Ll"],[1130,1130,"Lu"],[1131,1131,"Ll"],[1132,1132,"Lu"],[1133,1133,"Ll"],[1134,1134,"Lu"],[1135,1135,"Ll"],[1136,1136,"Lu"],[1137,1137,"Ll"],[1138,1138,"Lu"],[1139,1139,"Ll"],[1140,1140,"Lu"],[1141,1141,"Ll"],[1142,1142,"Lu"],[1143,1143,"Ll"],[1144,1144,"Lu"],[1145,1145,"Ll"],[1146,1146,"Lu"],[1147,1147,"Ll"],[1148,1148,"Lu"],[1149,1149,"Ll"],[1150,1150,"Lu"],[1151,1151,"Ll"],[1152,1152,"Lu"],[1153,1153,"Ll"],[1154,1154,"So"],[1155,1159,"Mn"],[1160,1161,"Me"],[1162,1162,"Lu"],[1163,1163,"Ll"],[1164,1164,"Lu"],[1165,1165,"Ll"],[1166,1166,"Lu"],[1167,1167,"Ll"],[1168,1168,"Lu"],[1169,1169,"Ll"],[1170,1170,"Lu"],[1171,1171,"Ll"],[1172,1172,"Lu"],[1173,1173,"Ll"],[1174,1174,"Lu"],[1175,1175,"Ll"],[1176,1176,"Lu"],[1177,1177,"Ll"],[1178,1178,"Lu"],[1179,1179,"Ll"],[1180,1180,"Lu"],[1181,1181,"Ll"],[1182,1182,"Lu"],[1183,1183,"Ll"],[1184,1184,"Lu"],[1185,1185,"Ll"],[1186,1186,"Lu"],[1187,1187,"Ll"],[1188,1188,"Lu"],[1189,1189,"Ll"],[1190,1190,"Lu"],[1191,1191,"Ll"],[1192,1192,"Lu"],[1193,1193,"Ll"],[1194,1194,"Lu"],[1195,1195,"Ll"],[1196,1196,"Lu"],[1197,1197,"Ll"],[1198,1198,"Lu"],[1199,1199,"Ll"],[1200,1200,"Lu"],[1201,1201,"Ll"],[1202,1202,"Lu"],[1203,1203,"Ll"],[1204,1204,"Lu"],[1205,1205,"Ll"],[1206,1206,"Lu"],[1207,1207,"Ll"],[1208,1208,"Lu"],[1209,1209,"Ll"],[1210,1210,"Lu"],[1211,1211,"Ll"],[1212,1212,"Lu"],[1213,1213,"Ll"],[1214,1214,"Lu"],[1215,1215,"Ll"],[1216,1217,"Lu"],[1218,1218,"Ll"],[1219,1219,"Lu"],[1220,1220,"Ll"],[1221,1221,"Lu"],[1222,1222,"Ll"],[1223,1223,"Lu"],[1224,1224,"Ll"],[1225,1225,"Lu"],[1226,1226,"Ll"],[1227,1227,"Lu"],[1228,1228,"Ll"],[1229,1229,"Lu"],[1230,1231,"Ll"],[1232,1232,"Lu"],[1233,1233,"Ll"],[1234,1234,"Lu"],[1235,1235,"Ll"],[1236,1236,"Lu"],[1237,1237,"Ll"],[1238,1238,"Lu"],[1239,1239,"Ll"],[1240,1240,"Lu"],[1241,1241,"Ll"],[1242,1242,"Lu"],[1243,1243,"Ll"],[1244,1244,"Lu"],[1245,1245,"Ll"],[1246,1246,"Lu"],[1247,1247,"Ll"],[1248,1248,"Lu"],[1249,1249,"Ll"],[1250,1250,"Lu"],[1251,1251,"Ll"],[1252,1252,"Lu"],[1253,1253,"Ll"],[1254,1254,"Lu"],[1255,1255,"Ll"],[1256,1256,"Lu"],[1257,1257,"Ll"],[1258,1258,"Lu"],[1259,1259,"Ll"],[1260,1260,"Lu"],[1261,1261,"Ll"],[1262,1262,"Lu"],[1263,1263,"Ll"],[1264,1264,"Lu"],[1265,1265,"Ll"],[1266,1266,"Lu"],[1267,1267,"Ll"],[1268,1268,"Lu"],[1269,1269,"Ll"],[1270,1270,"Lu"],[1271,1271,"Ll"],[1272,1272,"Lu"],[1273,1273,"Ll"],[1274,1274,"Lu"],[1275,1275,"Ll"],[1276,1276,"Lu"],[1277,1277,"Ll"],[1278,1278,"Lu"],[1279,1279,"Ll"],[1280,1280,"Lu"],[1281,1281,"Ll"],[1282,1282,"Lu"],[1283,1283,"Ll"],[1284,1284,"Lu"],[1285,1285,"Ll"],[1286,1286,"Lu"],[1287,1287,"Ll"],[1288,1288,"Lu"],[1289,1289,"Ll"],[1290,1290,"Lu"],[1291,1291,"Ll"],[1292,1292,"Lu"],[1293,1293,"Ll"],[1294,1294,"Lu"],[1295,1295,"Ll"],[1296,1296,"Lu"],[1297,1297,"Ll"],[1298,1298,"Lu"],[1299,1299,"Ll"],[1300,1300,"Lu"],[1301,1301,"Ll"],[1302,1302,"Lu"],[1303,1303,"Ll"],[1304,1304,"Lu"],[1305,1305,"Ll"],[1306,1306,"Lu"],[1307,1307,"Ll"],[1308,1308,"Lu"],[1309,1309,"Ll"],[1310,1310,"Lu"],[1311,1311,"Ll"],[1312,1312,"Lu"],[1313,1313,"Ll"],[1314,1314,"Lu"],[1315,1315,"Ll"],[1316,1316,"Lu"],[1317,1317,"Ll"],[1318,1318,"Lu"],[1319,1319,"Ll"],[1320,1320,"Lu"],[1321,1321,"Ll"],[1322,1322,"Lu"],[1323,1323,"Ll"],[1324,